{
  "schemaVersion": 1,
  "fidelity": "canon",
  "source": "SkoolKit disassembly of Sabre Wulf: Initialise Objects $A2BD, Room Objects $A33B, Object Location Table $DC6C, object handlers $A305/$A312/$A323, colours $A3A7",
  "fillPercent": 50,
  "fillPercentFidelity": "recon",
  "score": 150,
  "pickupBox": { "x": -6, "y": -14, "w": 12, "h": 12 },
  "sprite": "treasure",
  "fromScreen": { "dx": 8, "dy": -15 },
  "kinds": [
    {"frame": "crate", "ink": "brightRed", "effect": "score"},
    {"frame": "ring", "ink": "brightMagenta", "effect": "score"},
    {"frame": "fruit", "ink": "brightGreen", "effect": "score"},
    {"frame": "cap", "ink": "brightCyan", "effect": "score"},
    {"frame": "shield", "ink": "brightYellow", "effect": "score"},
    {"frame": "life", "ink": "brightRed", "effect": "extraLife"},
    {"frame": "money_bag", "ink": "brightMagenta", "effect": "score"},
    {"frame": "sword", "ink": "brightGreen", "effect": "score"},
    {"frame": "crate", "ink": "brightCyan", "effect": "score"},
    {"frame": "ring", "ink": "brightYellow", "effect": "score"},
    {"frame": "fruit", "ink": "brightRed", "effect": "score"},
    {"frame": "cap", "ink": "brightMagenta", "effect": "score"},
    {"frame": "shield", "ink": "brightGreen", "effect": "score"},
    {"frame": "shield", "ink": "brightCyan", "effect": "score"},
    {"frame": "money_bag", "ink": "brightYellow", "effect": "score"},
    {"frame": "sword", "ink": "brightRed", "effect": "score"}
  ],
  "slotsByRoomType": [
    [{"x": 80, "y": 63}, {"x": 64, "y": 127}, {"x": 136, "y": 127}, {"x": 208, "y": 127}],
    [],
    [{"x": 184, "y": 63}, {"x": 184, "y": 127}, {"x": 32, "y": 127}, {"x": 112, "y": 135}],
    [{"x": 32, "y": 63}, {"x": 80, "y": 127}, {"x": 112, "y": 63}, {"x": 176, "y": 127}],
    [{"x": 80, "y": 39}, {"x": 120, "y": 127}, {"x": 184, "y": 127}, {"x": 216, "y": 63}],
    [{"x": 32, "y": 95}, {"x": 88, "y": 87}, {"x": 120, "y": 119}, {"x": 208, "y": 103}],
    [{"x": 8, "y": 127}, {"x": 88, "y": 63}, {"x": 120, "y": 127}, {"x": 176, "y": 63}],
    [{"x": 48, "y": 127}, {"x": 72, "y": 103}, {"x": 160, "y": 63}, {"x": 200, "y": 95}],
    [{"x": 32, "y": 103}, {"x": 104, "y": 63}, {"x": 136, "y": 127}, {"x": 200, "y": 87}],
    [{"x": 40, "y": 127}, {"x": 112, "y": 127}, {"x": 152, "y": 63}, {"x": 176, "y": 127}],
    [{"x": 16, "y": 111}, {"x": 72, "y": 63}, {"x": 168, "y": 119}, {"x": 200, "y": 119}],
    [{"x": 56, "y": 127}, {"x": 64, "y": 63}, {"x": 88, "y": 119}, {"x": 176, "y": 63}],
    [{"x": 40, "y": 63}, {"x": 96, "y": 127}, {"x": 176, "y": 127}, {"x": 184, "y": 63}],
    [{"x": 72, "y": 127}, {"x": 96, "y": 63}, {"x": 152, "y": 127}, {"x": 200, "y": 63}],
    [{"x": 112, "y": 127}, {"x": 144, "y": 63}, {"x": 200, "y": 63}, {"x": 200, "y": 127}],
    [{"x": 48, "y": 79}, {"x": 88, "y": 127}, {"x": 160, "y": 63}, {"x": 216, "y": 127}],
    [{"x": 32, "y": 63}, {"x": 48, "y": 127}, {"x": 96, "y": 71}, {"x": 200, "y": 71}],
    [{"x": 144, "y": 135}, {"x": 152, "y": 63}, {"x": 208, "y": 63}, {"x": 224, "y": 127}],
    [{"x": 64, "y": 135}, {"x": 80, "y": 79}, {"x": 144, "y": 63}, {"x": 208, "y": 87}],
    [{"x": 64, "y": 71}, {"x": 80, "y": 127}, {"x": 168, "y": 63}, {"x": 168, "y": 127}],
    [{"x": 24, "y": 127}, {"x": 64, "y": 63}, {"x": 128, "y": 63}, {"x": 208, "y": 127}],
    [{"x": 40, "y": 127}, {"x": 88, "y": 63}, {"x": 120, "y": 127}, {"x": 208, "y": 127}],
    [{"x": 32, "y": 63}, {"x": 96, "y": 103}, {"x": 120, "y": 95}, {"x": 160, "y": 63}],
    [{"x": 32, "y": 63}, {"x": 40, "y": 127}, {"x": 120, "y": 127}, {"x": 200, "y": 63}],
    [{"x": 112, "y": 127}, {"x": 144, "y": 127}, {"x": 192, "y": 63}, {"x": 208, "y": 127}],
    [{"x": 40, "y": 95}, {"x": 56, "y": 127}, {"x": 176, "y": 127}, {"x": 208, "y": 111}],
    [{"x": 72, "y": 127}, {"x": 88, "y": 63}, {"x": 120, "y": 127}, {"x": 208, "y": 63}],
    [{"x": 128, "y": 63}, {"x": 176, "y": 127}, {"x": 200, "y": 127}, {"x": 224, "y": 63}],
    [{"x": 40, "y": 127}, {"x": 128, "y": 79}, {"x": 216, "y": 63}, {"x": 208, "y": 127}],
    [{"x": 24, "y": 63}, {"x": 32, "y": 127}, {"x": 160, "y": 127}, {"x": 216, "y": 127}],
    [{"x": 48, "y": 63}, {"x": 96, "y": 63}, {"x": 112, "y": 127}, {"x": 112, "y": 167}],
    [{"x": 72, "y": 63}, {"x": 40, "y": 127}, {"x": 160, "y": 63}, {"x": 160, "y": 135}],
    [{"x": 32, "y": 127}, {"x": 40, "y": 63}, {"x": 112, "y": 135}, {"x": 168, "y": 135}],
    [{"x": 32, "y": 135}, {"x": 72, "y": 63}, {"x": 120, "y": 127}, {"x": 208, "y": 127}],
    [{"x": 32, "y": 63}, {"x": 40, "y": 127}, {"x": 88, "y": 127}, {"x": 112, "y": 151}],
    [{"x": 112, "y": 135}, {"x": 184, "y": 63}, {"x": 184, "y": 119}, {"x": 184, "y": 135}],
    [{"x": 32, "y": 63}, {"x": 120, "y": 63}, {"x": 120, "y": 127}, {"x": 208, "y": 127}],
    [{"x": 104, "y": 87}, {"x": 104, "y": 127}, {"x": 104, "y": 63}, {"x": 104, "y": 151}],
    [{"x": 56, "y": 127}, {"x": 112, "y": 127}, {"x": 144, "y": 63}, {"x": 192, "y": 127}],
    [{"x": 64, "y": 95}, {"x": 104, "y": 63}, {"x": 200, "y": 127}, {"x": 208, "y": 63}],
    [{"x": 72, "y": 63}, {"x": 136, "y": 127}, {"x": 184, "y": 63}, {"x": 216, "y": 127}],
    [{"x": 56, "y": 63}, {"x": 88, "y": 127}, {"x": 136, "y": 127}, {"x": 168, "y": 151}],
    [{"x": 64, "y": 63}, {"x": 96, "y": 127}, {"x": 160, "y": 127}, {"x": 200, "y": 63}],
    [{"x": 32, "y": 119}, {"x": 104, "y": 63}, {"x": 160, "y": 127}, {"x": 208, "y": 63}],
    [{"x": 40, "y": 63}, {"x": 112, "y": 119}, {"x": 152, "y": 119}, {"x": 176, "y": 63}],
    [{"x": 40, "y": 63}, {"x": 120, "y": 127}, {"x": 192, "y": 127}, {"x": 208, "y": 79}],
    [{"x": 72, "y": 63}, {"x": 40, "y": 127}, {"x": 160, "y": 63}, {"x": 160, "y": 135}],
    [{"x": 72, "y": 135}, {"x": 192, "y": 63}, {"x": 208, "y": 79}, {"x": 208, "y": 135}]
  ]
}
